{
  "$schema": "https://json-schema.org/draft/2020-12/schema",
  "$id": "https://godotgs.local/.agentic/schemas/review.schema.json",
  "title": "Agentic Review Result",
  "description": "Structured output of one reviewer judging a fixed base..head diff. Reviewers change no code.",
  "type": "object",
  "additionalProperties": false,
  "required": [
    "schema_version",
    "reviewer_role",
    "base_sha",
    "head_sha",
    "verdict",
    "findings",
    "tests_reviewed",
    "evidence_reviewed",
    "blind_spots"
  ],
  "properties": {
    "schema_version": { "type": "integer", "const": 1 },
    "reviewer_role": {
      "type": "string",
      "enum": ["correctness-reviewer", "gpu-performance-reviewer", "verifier"]
    },
    "base_sha": { "type": "string" },
    "head_sha": { "type": "string" },
    "verdict": { "type": "string", "enum": ["approve", "changes_requested", "blocked"] },
    "findings": {
      "type": "array",
      "items": {
        "type": "object",
        "additionalProperties": false,
        "required": ["id", "severity", "category", "path", "evidence", "required_action"],
        "properties": {
          "id": { "type": "string" },
          "severity": { "type": "string", "enum": ["blocker", "high", "medium", "low", "note"] },
          "category": { "type": "string" },
          "path": { "type": "string" },
          "line": { "type": "integer" },
          "evidence": { "type": "string" },
          "required_action": { "type": "string" }
        }
      }
    },
    "tests_reviewed": { "type": "array", "items": { "type": "string" } },
    "evidence_reviewed": { "type": "array", "items": { "type": "string" } },
    "blind_spots": { "type": "array", "items": { "type": "string" } }
  }
}
